courseId,id,title,titleDescription,owner,ownerDescription,videoLength,students
A75,5f0fe663cad0d0ece0e58c6c,精通 Bootstrap 4 - 開發超強不解釋,此課程不在是念過所有元件的基礎課程，課程中會透過簡報、動畫不斷的強化同學對於網頁設計、Bootstrap 的運用觀念，並且在課程的進行中會透過許多的案例加深對於元件的使用概念，讓學習框架不再只是依循著文件內容而已。,六角學院,"「打破線上課程售後不理，我們在線上等你！帶你學到會的線上課程。」

六角學院 是一所線上程式開發學習單位，目前已累積 20,000 名學員，讓更多人藉由線上學習在職涯規劃上有更多的選擇是我們的使命是，如果您贊同我們的理念，歡迎加入六角。

我們將深入了解您想發展的領域，每位實習生我們都會量身打造專屬於您的舞台，並讓您實際瞭解公司營運 Know how。",42101,170
A76,5eda07470a10820918a5bc87,Python 進階課程：觀念、語法、專案、爬蟲,龐大的程式領域中，要自己有效地提升程式能力不容易，本課程將帶領只會基礎程式的同學，延伸精進對寫程式的了解與能力。,Allen 劉曣全,"畢業於美國 UCSD Computer Science 電腦科學系。7年以來，我致力於結合金融與科技，擁有豐富的國內外股票、期貨、選擇權交易經驗、與程式交易的開發與研究。此外，我熱衷於教學，曾開設實體班教學寫程式，並製作『Python - 輕鬆學會寫程式』於美國線上課程平台成為暢銷課程且廣受好評。

Python - 基礎課程：
https://bit.ly/2F2VNdi

Python - 進階課程：
https://hahow.in/cr/python-advanced

金融市場 x 程式交易：
https://hahow.in/cr/algotrading",133855,855
A77,5ec53ec912fc1b3c331b309f,個人品牌變現力：開始打造你的多元收入！,"想要副業，想要第二收入，想在職場上好好定位自己?
想要自我突破？想知道如何持續進步如何建立影響力?
你的煩惱我們聽到了，透過這堂課程，我們將告訴你如何了解自己，打造自己的個人品牌，進而轉化成收入來源，對於想要定位自己、創造收益的人不要錯過這堂課程！",江湖人稱S姐,"多年獵頭經驗，看過上萬份履歷，面試過各種不同職位人選，從工作與生活中體會人性；認為為人生規劃永遠大於職涯規劃。
對於人生，還在學。",17423,537
A78,5e34cc8550c9ee0024df5297,資料變決策！從零上手 Tableau 大數據視覺化,本門課程，主要介紹全球熱門的大數據分析工具 Tableau！ 結合資料探索和視覺化之優點，透過簡易的方式完成視覺化程序，讓使用者可以更隨心所欲的製作圖表，目標是讓學員可以了解工具的用法，並實際搭配案例進行各類實作練習。本課程規劃以中文步驟式教學Tableau 工具操作，詳細解析 Tableau 的各類實務操作過程，並引導親手做出專屬自己的資料視覺化成果，提升數據處理 / 數據分析 / 美學設計的能力，修習的學員除了能夠學習到工具的使用之外，也能知道做出友善資料視覺化的關鍵。,彭其捷,"大家好，我是彭其捷，我是一個資料分析師與數據專案經理，處理數據議題多年時間，至少出版了 10 本專書，其中『大數據時代必學的超吸睛視覺化工具與技術：Excel+Tableau成功晉升資料分析師』目前已經超過 15 刷，也被許多大專院校指定為指定教科書，並連續出版了數本關於數據分析的專書。

我熱愛分享，在許多機構進行過演講與教學課程，例如： kkday、中研院、工研院、資策會、台灣大學、清華大學、天地人學堂等等。致力於推廣資料應用、資料視覺化與使用者體驗設計。",27243,1017
A79,5dbe90cfa4b1c600214d0ab5,跨平台 APP - React Native 快速學習攻略,React Native 入門實作課程，從零開始帶你快速上手 React Native 程式語言。課程將使用 Expo CLI 的方式教你建立專案，手把手搭配實作專案，讓你上完課擁有跨平台開發 App 應用程式的基礎能力。,Avon,我是跨領域自學者，成大資源工程系、清大動力機械所畢業，非本科系自學程式，希望透過分享讓更多人也能透過自己的力量，做出自己想要做的事。,26149,533
A80,59eaaaa5ed6610001e82e1ba,免批卡免出國，也能日本代購批貨,日本代購批貨課程，教你如何經營日本代購，並取得日貨的批發資格。掌握日本代購的供應商和日貨商品的批發來源，適合網拍、實體店面經營者，或從事中盤批發，甚至是想增加額外收入的你。,Joanna＆Alan,"【分享所學．傳遞價值．幫助你找回初衷】
期盼能啟發你的內在智慧，讓你重新定義「生活」與「工作」，臣服於自己，開闊屬於你的人生版圖，讓生命有更多更多的可能性 : )",6817,949
