courseId,id,title,titleDescription,owner,ownerDescription,videoLength,students
A1,61e7f78a6d9e6f00067549ab,直播銷貨很容易！第一次導購直播就上手,"全民直播導購潮來臨，每個人都可以打開直播銷售賣貨，但卻不是人人都能成功。
想要高人流、高轉換率、展現導購直播主獨特的個人行銷魅力，你一定不能錯過這堂課！",品好文化,"品好文化專注在數位新媒體發展，並持續在影像製作領域精進，無論是：
影像製作 / 直播服務 / 線上課程錄製 / 自媒體經營
我們都希望能將您的才華，公 諸 於 世！",7346,60
A2,6130495cd5d02a00071f2c3b,PChome 電商大學：給初學者的行銷入門課,電商成為新時代熱門產業，但台灣沒有電商系，想要搶先一步了解電商產業該怎麼辦?台灣電商產業龍頭PChome首度開班授課，教授電商行銷秘訣，從電商線上線下布局、社群經營、到數位行銷提案，這堂課可以讓你在短時間內從0開始了解電商的行銷布局，認識電商經營策略!,pchome2021,走過21的本土電商PChome開課囉!希望藉由開創台灣電商藍圖的經驗，分享給對電商產業有興趣的人們，讓我們一起「穩定」耕耘學習吧!,6705,225
A3,5e7a1ead9c4b140023a8536f,職場人必學的商業分析術,帶你學會產品與服務開發以及專案前中後期所需要的商業分析，包括數據收集與分析，運營企劃書提案，利害人關係分析，溝通協調心法，解決方案評估，需求導出的方法，建立流程模型與需求書等。這堂課不只是商業分析，其應用範圍更是與「軟體開發流程、需求分析與企業數位化息息相關」不管你是業務單位需要接觸到數位化或資訊相關單位想進一步了解如何有系統採集各業務部需求都可以一窺分析全貌。,Monica,大家好，我是Monica，簡莘怡。政治大學商學院畢業，在號稱歐洲矽谷的倫敦擔任商業分析顧問同時也是一名專案管理師，在過去的十年間，帶領過歐美眾多知名公司進行各種專案管理與商業分析。,27908,692
A4,5d242f020d5f3b0021dd3a75,illustrator 入門：從形狀到美麗的向量插畫,Illustrator 設計入門課程，將你的創造力透過 illustrator 設計呈現。課程專為初學者設計，從 illustrator 的介面操作開始，結合有趣的設計案例，讓你邊做邊學，累積向量繪圖的扎實能力。,Iris Lee,當你閃光，你就照亮了前程。我知道，僅僅通過執著於步驟並對意料之外的事情坦然接受，我就創造出了一條通往創意靈感的通道，這是一件及其有力的東西。,35801,786
A5,5b33cd4f2c4c44004391c836,PHP 攻略：Laravel 5.8 從入門到實務,厭倦低薪工作或想寫自己的電商網站？別怕菜程式，哥布林工程師(林品爵)帶你輕鬆學 Laravel 程式，保證讓你無痛寫出自己的第一個電子商務網站！,哥布林老師,我是哥布林老師，是哥布林程式教育學苑的創辦人，也是Laravel的EasyWeb套件開發者，雖非資工科班出身，但不覺間也在資訊產業擁有自己的一片天。,63273,272
A6,59f97b57a77a2d001eea8504,【電商正夯】找工作找實習必備 4 大技能,電商必備技能課程，掌握進入電商的基本技能與應用能力。課程將從商品行銷、素材設計開始，到客戶服務與商品出貨的概念與技能，帶你進入電商領域，作為你求職、轉職的即戰力。,TeSA,TeSA 臺灣電子商務創業聯誼會，由利來管理顧問有限公司負責營運。我們的發展目標，包括：匯聚臺灣電商人才、蒐集電商資訊，並促進創業團隊與境外電商的交流。,27381,994
A7,59849fbcacc1370700075d44,網路行銷全方位入門實戰（下集）,數位行銷進階課程，將從網站概念開始介紹，並教你搜尋引擎運作原理。課程也包含數據分析與應用、電子商務流程，以及蔚為趨勢的網紅行銷、口碑行銷，全方面的帶你理解數位行銷必備知識。,樊志霆,網站分析背景出身，出社會後投入網路行銷領域超過10年，是台灣少數結合行銷、技術、數據三項領域的專家，專注於網站數據分析、網站開發、搜尋引擎優化、報表視覺化等實務面工作，也擅長將工作上寶貴的經驗轉化為淺顯易懂的課程，曾任多間知名企業的數據顧問、電商營運分析主管，現任知名跨境球鞋電商首席數據分析師。,33077,775
A8,594f29d013cd380700228e7d,網路行銷全方位入門實戰（上集）,數位行銷入門課，適合網路行銷初學者。課程包含社群行銷、廣告文案撰寫、專案企劃、設計等技能教學，這堂數位行銷入門課將完整教你掌握網路行銷必備的五大能力。,樊志霆,網站分析背景出身，出社會後投入網路行銷領域超過10年，是台灣少數結合行銷、技術、數據三項領域的專家，專注於網站數據分析、網站開發、搜尋引擎優化、報表視覺化等實務面工作，也擅長將工作上寶貴的經驗轉化為淺顯易懂的課程，曾任多間知名企業的數據顧問、電商營運分析主管，現任知名跨境球鞋電商首席數據分析師。,44207,1968
A9,591a80571aa4b60f00364020,從零開始學文案 — 育名的文案小教室,文案撰寫入門課程，系統化的帶你從觀察、構思、撰寫、優化等步驟來檢視文案。教你文案撰寫的思考脈絡和如何寫出吸引人的標題，以及社群文案的撰寫重點，你也能寫出打動人心的達標文案。,min043046,"ＦＢ粉專：https://www.facebook.com/minmixedlearning

現在正在北京吸霧霾創業中。

1994年生，雙子座，從小在天龍國旁的一個小鄉鎮長大。
個性很怪，有時直爽、活潑，有時糾結、孤僻。喜歡老的、舊的各種東西，但又矛盾的喜愛極新的科技、互聯網；腦洞大開時可以想出各種天馬行空的點子，冷靜沈著時又會保守的讓自己很難向前走出任何一步。

喜歡攝影、烹飪、寫文章、與人交談。有時覺得自己善良，有時覺得自己邪惡；路見不平會拔刀，相助不相助全憑當時心情與氣力；偶爾反省自己，反省過度讓自己焦慮的睡不著是家常便飯，但往往付諸實踐還是得要一大段時間。

身體很糟，生活很老人很養生。",16817,333
A10,609dd3159c845e22c62117a3,【短片新手村】零拍攝短影片製作術,"你想速成短片，讓眾人驚嘆連連！？
TikTok 千萬讚網紅教你短片免拍術，
學會免拍攝影片創作法來省錢省力，
用 AE 做出吸睛爆紅社群與商業影片！",阿狗阿貓 x Makee Z,"千萬讚60萬粉絲TikTok圖文作家，
熱愛分享插畫 貼圖&短片製作術，
立志助你發光發熱實現不凡理想！",7545,179
A11,5ecf1e19f52bb449c74e7e4b,做圖啦！設計省攻略：品牌應用新手速成,"你在創業或經營品牌社群網拍電商？
你是餐廳小吃飲料或行銷小編助理？
你想省錢快速學平面設計排版印刷？
職場工作新手製圖的 Illustrator 教學！",Makee Z 愛自學,"我們喜歡自學，但是更熱愛分享！
政府學校曾多次邀請開設工作坊，
透過分享設計、行銷與自助旅遊，
立志助你發光發熱實現不凡理想！",11460,440
A12,5e3bb7b0c2fd100024c806f2,蝦皮新手賣家行銷術：斜槓副業第一步,"你想兼職副業但不懂網拍開店？
你的賣場冷清不知初期怎突破？
自學蝦皮個人賣家網拍行銷術，
菜鳥也能 DIY 人氣蝦皮賣場！",Makee Z 愛自學,"我們喜歡自學，但是更熱愛分享！
政府學校曾多次邀請開設工作坊，
透過分享設計、行銷與自助旅遊，
立志助你發光發熱實現不凡理想！",8572,977
A13,5ca17cd572a72f002150ed9d,GA 從零上手！數位時代必學的數據行銷秘笈,GA 入門課程，帶你學習數位時代必備的數據行銷。課程將由淺入深介紹 GA 的操作技巧與指標，教你如何運用數據來追蹤網站成效，並透過數據找出網站需要優化的地方。課程也將使用大量案例作為範例，透過實戰，帶你更快上手，將 GA 應用在工作中。,數位時代,《數位時代》跨越數位與傳統紙本媒體，串連線上與線下的資訊傳遞與實體活動，打造「大社群時代」的科技媒體。,13012,1971
A14,5bd6cafa2febb1001e900594,【幫寶貝做照片貼圖】用愛保鮮回憶,"寶寶情侶個人小孩寵物結婚動態貼圖DIY最省錢！
親密時光錯過了就永遠不會再回來，
自己學動態照片貼圖製作，只要一夜就完成！",阿狗阿貓 x Makee Z,"千萬讚60萬粉絲TikTok圖文作家，
熱愛分享插畫 貼圖&短片製作術，
立志助你發光發熱實現不凡理想！",3018,111
A15,5a32a1c6a99031007d977e9d,內容力：打造品牌的超能力,內容行銷課程，教你透過寫作，創作出高品質且吸引人的行銷內容。課程將從文案寫作開始，教你寫作架構與內容策略擬定，並透過實際內容行銷案例的分析，帶你掌握內容行銷的操作訣竅，最後也會介紹常見的行銷媒介，教你成為無往不利的內容駭客。,Vista,Vista來自風城新竹，現居臺北市，平常喜歡看看書，寫寫字。曾任《風傳媒》產品總監和《數位時代》雜誌主編，關注文化創意、資訊科技、網路社群與行動網絡之發展。文章散見《英語島》雜誌、《推推房》網站、《內容駭客》網站與《Fuel Up》網站等媒體，歡迎造訪其部落格或Facebook粉絲專頁。,7640,825
A16,59fc084fa77a2d001eea9286,不會畫圖也能創作角色LINE動態貼圖,LINE動態貼圖課程，完全不會繪圖/動畫軟體，也能完成專屬的 LINE 動態貼圖。課程將教你用Ai和 AE兩大軟體，製作好看又實用的 LINE專屬貼圖。,阿狗阿貓 x Makee Z,"千萬讚60萬粉絲TikTok圖文作家，
熱愛分享插畫 貼圖&短片製作術，
立志助你發光發熱實現不凡理想！",4955,436
A17,628b1d45b38e8100072ca394,找回美麗腰背線！筋肉媽媽的科學化核心肌群訓練,許多體態變形、亞健康痠痛、活動度降低導致受傷，大多與核心肌群無力有關，這堂課就是要用科學健身的概念，從深層打造到外觀雕塑，循序漸進幫你找回核心肌群的內在力量，由內而外真正達到緊實好看的線條，找回你健康舒適又自在的身體！,筋肉媽媽,"從媒體產業轉行到體適能產業，短短幾年取得ACE美國運動協會官方登陸的國際講師資格，可以教授教練證照；2018年成為健美國家代表隊選手，2019年拿到IFBB國際健美總會職業運動員身份；也是運動健康科學所得的研究生。

從手腳不協調的產後媽媽，到成為擁有專業與成績的體適能教練講師與運動員，將短短幾年就大有成效的訓練概念與國際研習心得彙整，用小白都能聽懂的方式教學，正是筋肉媽媽的強項。

目前是教練、是身心靈健身作家、是演講家，也是國際體適能證照代理Fit Strong飛創國際教育平台的講師。

面對大眾客戶與教練的教學，已經破千人。

專長：功能性訓練整合/孕產婦訓練/型體健美訓練/女性增肌減脂/特殊族群訓練/皮拉提斯；

同時是運動健康科學研究所研究生、中華台北國家隊健美選手、國際健美總會菁英職業卡選手、中華民國健美健身協會理事、大專體育總會健美委員會執行秘書，也是體育署運動企業認證合作講師。

期望能讓所有女性身心靈健康富足，從運動中找到自我覺醒的力量，肯定自我價值，一直是支持我創業與推廣健身的動力。

女人們，需要被呵護對待，需要被愛護，首先的對象，就是我們自己要學會愛自己喔！
",15251,625
A18,61a5d89b3b954c0007022c77,後疫情時代鏡頭表達力，洪婉蒨的鏡頭教練課,市面上唯一聚焦「面對鏡頭表達」的課程。教你如何在線上商務會議、直播銷售或線上教學時，運用上鏡的非語言訊息與肢體語言，讓客戶信任你、消費者買單、學生專注。,鏡頭教練洪婉蒨,曾是電視台新聞主播、新媒體影音總監，現經營自媒體【你的鏡頭教練】。是少數經歷橫跨傳統媒體、新媒體及自媒體的媒體人，故同時擔任直播顧問、中英雙語主持人和企業內訓講師，教學主題包含【鏡頭表達力】、【直播銷售】及【訪談主持力】。,12842,404
A19,6191c002a20c140006edcfcd,Home appétit！在地食材打造道地法式料理,深耕餐飲界多年的簡天才師傅，將三十多年的經歷，濃縮轉化為這一堂線上課程，除了醬汁、高湯與經典菜的詳細教學外，也希望可以將「追求在地特色食材」的料理精神，與自身料理哲學，傳達給更多朋友。,簡天才 THOMAS CHIEN,"不論是創新或傳承，廚藝技術的目的都在於滋養人類。

「我如果不在餐廳，便在尋找食材的路上」；足以說明我的人生況味了！",13059,154
A20,61888f9bb259500007e2cb20,米其林三星主廚教你做！時尚法式甜點的秘密,首次公開「Hin 任樂軒」的法式甜點，Chef Hin 全程教你做，烘焙新手也能掌握配方比例、裝飾技巧。我將一步步帶你用家裡現有器材，做出漂亮的美味法式甜點，療癒無法外出的心～,Hin 任樂軒  x 三十創意,Chef Hin是國際知名甜點設計師，曾受邀擔任世界各國西點、酒店的西點行政總廚。不僅如此，更在台灣大專院校擔任客座講師，讓法式甜點製作更為親民，持續創作屬於在地的創意甜點。曾任職香港米其林三星侯布雄、美國舊金山米其林一星餐廳 Madera、北京及舊金山瑰麗酒店、台北文華東方西點行政總廚、上海半島酒店西點副主廚、榮獲北美 Valrhona C3 巧克力比賽銀獎。,14504,265
A21,61381a3f33a3960006df1eb3,RyuuuTV看動漫看日劇，零到N4道地說日文,"Ryu 和 Yuma 帶你從五十音，一步一步帶入完整句子、進步到日文 N4。
從大家的生活會接觸的情景，如：旅遊、動漫、動畫、日劇、流行歌，
用活潑短劇的方式演出，分析對話、經典臺詞的句子結構與文法，
除了能搞懂考試必備的範圍，還能加強日文口語與聽力！",Ryuuu TV / 學日文看日本,大家好，我們是 Ryu 和 Yuma，是一個住在日本的馬來西亞男生和日本老婆夫婦檔經營的學日文看日本頻道！希望透過 Youtube 拉近日本跟大家的距離～讓大家看我們就像住在隔壁的朋友那樣看見日本！,35627,7609
A22,6136ed9fafdea00006bdd8ee,小資族圓夢計畫，第一次買房收租就上手,這門課程將教會你各種房產投資的知識，包括整層收租、隔套收租、二房東等，讓小資族的你可以了解不同包租公的進出場策略，以及如何降低風險，幫助你第一次買房收租就上手，並且創造穩定的被動收入。,RICHARK,是一個「全方位教練系統 Total Coaching System」，為創辦人「吳建賢Cosmo」所成立，以「方舟計劃」尊榮會員制運作，人脈資源整合及教練諮詢並結合教育訓練系統，透過實戰操練及創業輔導，協助學員打造被動收入邁向「財富自由」。,8340,162
A23,611ef5cbeb00c70006f87b1a,知識煉金師帶你「做份好筆記，要事全都記」,資訊爆炸時代，自學是必要能力，筆記則是必要技術，如何透過快速筆記進行資料的蒐集彙整與提問是在職場上學習必要的核心軟實力，本課透過筆記輸入的萃取進行應用輸出的轉化，讓學習掌握重點加快速度。,魏美棻 Nancy Wei,教授圖解、筆記、數位工具、職涯盤點,4721,533
A24,60e67da88f992a0006529dc6,Excel Power BI 購物籃分析及視覺化實戰,第一門以「Excel Power BI」結合「商品搭售分析」出發的資料視覺化課程，協助您找出各產品間的「關聯性規則」，從消費者購買機率的角度出發，將產品作不同的組合搭配，打造「產品組合推薦清單」，有效提高顧客成交率！,陳俊凱 Luke Chen,我是Luke，在Hahow開設《不寫程式的數據分析： Excel 商業分析實戰》與《Excel Power BI 購物籃分析及視覺化實戰》，擅長以常遇到的實際問題作為課程案例，以簡潔明瞭的教學風格，帶領你一步步成為Excel與Google sheets 行家。,22626,72
A25,60ddad1db45f210006cd32d7,原型師模型課程：九天衡-邪羊莉莉,"以原創故事題材《九天衡》系列的角色、惡魔邪羊擄獲的少女莉莉為範例。
帶你親手製作出人物模型。
除了講解女性臉部、身體比例、動態、肌肉的雕塑方法之外，還會分享怪獸頭骨、武器與翅膀的製作。
",pkking636178,"目前任職於大葉大學-多媒體學系、除了平時上課教學示範、產學案、跟學生嘴砲，還有擠時間做自己的創作跟做不完的委託。
最喜歡的是把自己創作的故事人物、用雙手一步步的實體化、會讓我感到很開心。",69787,268
A26,60d801869643fa393b2e209c,減法攝影，感官加乘：逐格收藏觀景窗裡的世界,「這個世界太大，所以我用觀景窗擷取我喜歡的片段，珍藏。」由攝影師張道慈（破渡）教授的攝影課程，並非傳授一門叫做「減法攝影」的技巧，而是要分享一種概念——教你「怎麼看」，並且拆解眼前的世界。,張道慈,"hi, 我是道慈，我是一位職業攝影師，出過兩本書，目前與一群朋友經營 youtube 頻道「我都ok啊」",28713,1915
A27,606441d726c9ad200cbe2e56,零失敗！海頓媽媽的常溫甜點禮盒,"擁有 20 多年烘焙經驗的海頓媽媽烘焙祕技大公開！
課程中將傳授大家用簡單的方式操作各式餅乾的烘焙製作，全新獨家配方，以及很多你沒看過的烘焙技法。並會分享如何進行餅乾包裝組合的變化，完成一系列各式吸睛療癒的甜點禮盒。
",haydenmom,料理烘焙實驗家-海頓媽 。唸電機系的海頓媽媽熱愛分享料理及烘焙,22069,706
A28,60613eb176bf3b2443c0ac5f,遙控 X 攝影：休伯特的戶外空拍運鏡指南,將與你分享空拍機選購、飛行區域辨識、空拍機 APP、空拍作品賞析，及各種環境空拍的注意事項。還會教你平常可執行的基礎練習，來提昇空拍技巧。,休伯特,,16389,117
A29,6000fd0607af5c1d4a55d231,黃子瑜鼓教室 | 爵士鼓職人 12 週養成計劃,想要成為職業樂手卻不知道從何開始努力起？「爵士鼓職人 12 週養成計劃」就是你最好的選擇！由擔任劉德華世界巡迴演唱會鼓手的業界知名樂手黃子瑜老師親自設計，從他自身的演奏經驗為各位精心編排 12 堂終生受用的課程，搭配專為此課程編寫的練習範例，12 週為你扎實打造音樂職人必備的基本功！,黃子瑜 (Fish),活躍於兩岸三地音樂圈，不時參與各大音樂節、演唱會、專輯錄音活動；近年更以爵士樂手身份參與各地爵士演出。至今已參與/發行過五張爵士專輯，也錄製過無數藝人的專輯作品，不僅為華人巨星劉德華指定世界巡回演唱會鼓手，更曾以 Band Leader 的身分與伍思凱於亞洲進行了近20場演唱會，2020年更受邀擔任台灣金音獎評審一職。近年子瑜重心放在台灣香港兩地，除了爵士與流行的演出與製作之外，更致力於推廣爵士鼓教育，經營「黃子瑜鼓教室」YouTube 頻道。現為Canopus Drums、Meinl Cymbals、Schlagwerk 代言人，樂團「R.O.O.T」鼓手，目前任教於台南藝術大學。,5588,215
A30,5fe78a2be810e1a5ff89b17f,軟體需求溝通─從外商公司學跨部門協作開發,講師為美商 Tech Lead，曾開課在近千名學員中獲得五星好評，這次要教你精準溝通需求，並輕鬆轉成軟體規格，在公司或是創業，都能派上用場。,Jayden Lin,Jayden Lin，任職 Yahoo，擔任 Tech Lead，帶領團隊做跨國專案開發。同時也是 《程式猿吃香蕉》團隊創辦人，喜歡將實用的軟體知識以簡單生動的方式講給大家聽。,46905,725
A31,5fe5f2025a899784aa96f52b,基礎戳繡 Punch needle．食繡植繡｜戳出療癒手感創作,"​​戳繡 PUNCH NEEDDLE ：以植物系列、餐桌系列主題展開一趟由淺入深的學習之旅
針法有層次但不艱深，就像插飲料吸管那般療癒！透過這堂課，在家即可體驗戳繡創作，用戳針療癒靈魂。",寫生刺繡  Hsieh Sheng Embroidery,,9344,147
A32,5fb68b7e2712ed3cc7a03448,人氣喫茶店 KADOYA 主廚帶你做日式洋菓子,"本課程為初階帶領各位進入日式甜點的課程，老師直接教您實戰，跟您分享如何在短時間內製作出美味的人氣甜點！
課程中教您的口味還可自行調配，無論是販售或者招待貴賓，不用再去買不愛的甜點。
餐廳的飯後點心，也可自行製作，不用再靠批發，減少報廢，增加利潤。",HomeHome Wu,"KADOYA 喫茶店主廚吳宗鴻師傅。

曾赴日本學習甜點、打工實習，回台後在台南創設高人氣、充滿日式懷舊風的 KADOYA 喫茶店，店裡從擺設、裝潢到甜點都有濃濃日式氣息。",5994,76
A33,5fb6886a56addceac864bdcd,掌握鉤針編織邏輯：五種針法自造生活小物,"「從初學就打好基礎」

針對鉤針新手設計的鉤織課程，只要瞭解五個基礎針法，就可以享受鉤針編織無窮的變化～
在我們設計的練習作品中，藉由反覆的編織動作，讓身體幫你加速學習。學會看懂市售編織書裡的織圖，並且獨立完成各種療癒的作品，讓編織成為你生活的陪伴。

「想設計出心目中的作品」
拆解與重組的心法傳授！
這堂課我們會拆解鉤織的基礎原理，從簡單的點、線、面出發，
讓看似複雜的編織化整為零，變成可以任意組合的各種元素。
藉著控制編織變數的加與減，來探討不同編織作品之間的設計關係。
掌握原理，編織就可以隨心所欲，嘗試設計出屬於自己的作品吧！
",Mu/s Craft毛線球牧場,毛線球牧場主人，2012 年自創品牌，著重以新手視角為出發點的編織課程設計，於台灣、香港、日本等地開設了無數場次的實體編織工作坊，教學經驗豐富。作品以自然素材為起點，透過極簡、樸實的概念，建立起獨特的品牌氣味，也期望在體驗材質的過程中，為學員尋找更多設計的玩性與可能。,24611,1264
A34,5faa5f842f4eaa9b95e02b7c,拍一次就搞定！FB IG YT 通用的行銷影片,"你知道影片版面如果比例不合造成留白，轉換率會降低超過1成嗎？你又知道橫式影片、直式影片、甚至是正方形影片都有不同的使用時機嗎？
影片是社群行銷中不能漏掉的剛需素材！但各種社群影音平台如 FB、IG、YouTube 甚至現在漲粉最快的TikTok，各有不同的影音特性、規格、與受眾喜好。到底影片該直的拍還是橫的拍？片長該多長才有效？不同的平台有不同需求！這門課講告訴你如何拍一次就搞定各類影片素材！事半功倍，最合乎製作效益！",一學,"一學 拼了視覺創意 創意總監
主要擅長製作各類型行銷影片，包含企業形象／產品介紹／活動紀錄／人物訪談，能夠為客戶的影片訂製出最有成效的企劃腳本，精準掌握客戶需求；合作客戶包含觀光局、工研院、中天眼鏡、Lamigo、國會政黨聯盟、林口新創園區、成功嶺等。
同時也擁有 14 年的教學經歷，是各大企業影音行銷指定培訓講師，課程內容主要包含「拍攝」、「剪輯」的實戰課程；授課單位包含 BenQ、城邦集團、Panasonic、早安健康、世新大學、致理科技大學等。",9065,153
A35,5fa00d88a7ab9018ab556ecf,跨國紙筆之旅：B6 速寫男帶你畫遍全世界,"透過網路，我們看到更廣的世界，突破國際的限制，網路上各國街景的素材垂手可得，如果剛好我們又喜歡畫畫, 是不是也能拿起筆來參考將這些畫面來練習，或甚至創作出有自我風格的街景速寫呢? 

這個課程, 我將從各國美景出發，帶著大家進入速寫的環遊之旅，並且以漸進的方式,，不受地理的限制、帶大家一步一步畫出好看的街景速寫。拿起畫筆來場虛擬旅繪，趁著現在學習速寫，練練功。待疫情結束後，我們就可以在旅途中好好賣弄一番了！",B6速寫男," Mars B6 速寫男
喜歡美術與設計，十多年來從事 UI/UX 設計的工作。最近幾年重拾畫筆，透過速寫的方式來記錄所見所聞。",35960,1654
A36,5f7c708195e78a08702c50f4,火頭工做麵包：與酵母共舞，設計專屬配方,掌握製作麵包的關鍵「酵母」！阿段烘焙的火頭工吳師傅，帶你認識酵母與麵團的特性，揭開麵包「氣孔組織」與「表皮口感」的神秘面紗。更親自示範十款具代表性的歐式麵包，指出製作時容易失敗的操作重點，系統化理解酵母製作的科學原理，不再死守固定配方，設計出具有個人特色的麵包。,火頭工 Ｘ 聯經出版,擔任「阿段烘焙」麵包師，至今約 15年。建立部落格「烤箱邊的故事」，分享麵包製作技術和理論。為了能與全世界的工藝麵包師（Artisan Baker）接軌，加入世界各地工藝麵包師傅的群組和社團，從事技術、理論與文化的交流。,30387,1059
